{
  "schema": "dailyfuel/map-weigh-osm/1",
  "source": "OpenStreetMap, fetched through the Overpass API",
  "source_url": "https://www.openstreetmap.org",
  "licence": "Open Database License (ODbL) 1.0",
  "licence_url": "https://opendatacommons.org/licenses/odbl/1-0/",
  "attribution": "© OpenStreetMap contributors",
  "attribution_url": "https://www.openstreetmap.org/copyright",
  "queries": {
    "weighbridge": "[out:json][timeout:240];area[\"ISO3166-1\"=\"US\"][\"admin_level\"=\"2\"]->.us;nwr(area.us)[amenity=weighbridge];out tags center;",
    "tags": "[out:json][timeout:240];area[\"ISO3166-1\"=\"US\"][\"admin_level\"=\"2\"]->.us;(nwr(area.us)[service=weigh_station];nwr(area.us)[amenity=weigh_station];nwr(area.us)[amenity=weight_station];nwr(area.us)[man_made=weigh_station];);out tags center;",
    "names": "[out:json][timeout:240];area[\"ISO3166-1\"=\"US\"][\"admin_level\"=\"2\"]->.us;(nwr(area.us)[name~\"[Ww]eigh [Ss]tation|[Pp]ort of [Ee]ntry|[Ss]cale [Hh]ouse|[Ii]nspection [Ss]tation|[Ww]eigh [Ss]cale|[Tt]ruck [Ss]cale|[Ww]eight [Ss]tation\"];nwr(area.us)[amenity~\"^(weigh_station|weight_station)$\"];nwr(area.us)[man_made=weigh_station];nwr(area.us)[highway~\"weigh\"];);out tags center;"
  },
  "osm_base": "2026-09-20T01:22:43Z",
  "fetched": "2026-09-19",
  "dedupe_m": 600,
  "note": "Candidates, not a complete list. Weigh and inspection stations in OpenStreetMap, minus CAT Scale and other truck stop scales, border crossings, agricultural and vehicle inspection sites. Coverage is measured in coverage.json.",
  "counts": {
    "candidates": 453,
    "dropped_agricultural": 38,
    "dropped_border": 156,
    "dropped_border_outline": 28,
    "dropped_cat_scale": 2128,
    "dropped_closed": 11,
    "dropped_not_a_station": 19,
    "dropped_outside_us": 0,
    "dropped_private": 208,
    "dropped_private_scale": 1413,
    "dropped_road": 89,
    "dropped_vehicle_inspection": 20,
    "dropped_weak": 48,
    "elements": 4735,
    "kept": 605,
    "sites": 425,
    "states": 47,
    "via_name": 113,
    "via_tag": 312
  },
  "sites": [
    {
      "lat": 24.95463,
      "lon": -80.58133,
      "name": null,
      "state": "FL",
      "via": "tag",
      "osm": [
        "w194144374"
      ]
    },
    {
      "lat": 25.9541,
      "lon": -97.41855,
      "name": null,
      "state": "TX",
      "via": "tag",
      "osm": [
        "w1163638974"
      ]
    },
    {
      "lat": 26.0925,
      "lon": -98.20006,
      "name": "Pharr Texas Port of Entry",
      "state": "TX",
      "via": "tag",
      "osm": [
        "w1113538802",
        "r19466797"
      ]
    },
    {
      "lat": 26.8798,
      "lon": -81.985,
      "name": null,
      "state": "FL",
      "via": "tag",
      "osm": [
        "w194144552",
        "w194144554"
      ]
    },
    {
      "lat": 27.16668,
      "lon": -98.1496,
      "name": "CMV Inspection Station",
      "state": "TX",
      "via": "name",
      "osm": [
        "n9535535832",
        "n9535535833"
      ]
    },
    {
      "lat": 27.18868,
      "lon": -80.40078,
      "name": null,
      "state": "FL",
      "via": "tag",
      "osm": [
        "w194144533"
      ]
    },
    {
      "lat": 27.61398,
      "lon": -99.52432,
      "name": null,
      "state": "TX",
      "via": "tag",
      "osm": [
        "w1159100232"
      ]
    },
    {
      "lat": 27.70695,
      "lon": -99.73416,
      "name": "TxDOT Inspection Station",
      "state": "TX",
      "via": "name",
      "osm": [
        "w1184123871"
      ]
    },
    {
      "lat": 27.93764,
      "lon": -82.11382,
      "name": "Hopewell Weigh Station",
      "state": "FL",
      "via": "tag",
      "osm": [
        "w776377301"
      ]
    },
    {
      "lat": 28.01547,
      "lon": -82.26526,
      "name": null,
      "state": "FL",
      "via": "tag",
      "osm": [
        "n9893694797"
      ]
    },
    {
      "lat": 28.01845,
      "lon": -82.27274,
      "name": null,
      "state": "FL",
      "via": "tag",
      "osm": [
        "n9893694794"
      ]
    },
    {
      "lat": 28.04557,
      "lon": -99.34826,
      "name": null,
      "state": "TX",
      "via": "tag",
      "osm": [
        "w1152299366"
      ]
    },
    {
      "lat": 28.1552,
      "lon": -81.80007,
      "name": null,
      "state": "FL",
      "via": "tag",
      "osm": [
        "w1256814396"
      ]
    },
    {
      "lat": 28.37082,
      "lon": -82.57089,
      "name": "Weigh Station",
      "state": "FL",
      "via": "name",
      "osm": [
        "w532290051"
      ]
    },
    {
      "lat": 28.99289,
      "lon": -82.14389,
      "name": "Wildwood I-75 Weigh Station Northbound",
      "state": "FL",
      "via": "tag",
      "osm": [
        "w194144619",
        "w697822478",
        "w697822485"
      ]
    },
    {
      "lat": 29.19586,
      "lon": -95.4565,
      "name": null,
      "state": "TX",
      "via": "tag",
      "osm": [
        "w1259732182"
      ]
    },
    {
      "lat": 29.4602,
      "lon": -98.31561,
      "name": null,
      "state": "TX",
      "via": "tag",
      "osm": [
        "w1368186768"
      ]
    },
    {
      "lat": 29.51172,
      "lon": -81.19679,
      "name": "Flagler I-95 Weigh Station",
      "state": "FL",
      "via": "tag",
      "osm": [
        "w194144623",
        "w194144628",
        "w1380981517"
      ]
    },
    {
      "lat": 29.55982,
      "lon": -81.26875,
      "name": "Palm Coast Southbound US-1 Weigh Station",
      "state": "FL",
      "via": "name",
      "osm": [
        "n13429605901",
        "n13429605923"
      ]
    },
    {
      "lat": 29.5955,
      "lon": -82.96938,
      "name": null,
      "state": "FL",
      "via": "tag",
      "osm": [
        "w194144386"
      ]
    },
    {
      "lat": 29.74524,
      "lon": -81.34927,
      "name": null,
      "state": "FL",
      "via": "tag",
      "osm": [
        "w1365984785"
      ]
    },
    {
      "lat": 29.77341,
      "lon": -96.07436,
      "name": "CMV Inspection Station",
      "state": "TX",
      "via": "tag",
      "osm": [
        "w1083360859"
      ]
    },
    {
      "lat": 29.8547,
      "lon": -95.12963,
      "name": null,
      "state": "TX",
      "via": "tag",
      "osm": [
        "w1125577694"
      ]
    },
    {
      "lat": 30.03647,
      "lon": -94.15486,
      "name": null,
      "state": "TX",
      "via": "tag",
      "osm": [
        "w362156420"
      ]
    },
    {
      "lat": 30.08517,
      "lon": -90.44435,
      "name": null,
      "state": "LA",
      "via": "tag",
      "osm": [
        "w1105736623"
      ]
    },
    {
      "lat": 30.09988,
      "lon": -90.48242,
      "name": "Eastbound LaPlace Weigh Station",
      "state": "LA",
      "via": "name",
      "osm": [
        "w1001916853",
        "w1001916854"
      ]
    },
    {
      "lat": 30.10384,
      "lon": -97.30618,
      "name": null,
      "state": "TX",
      "via": "tag",
      "osm": [
        "w1190041377"
      ]
    },
    {
      "lat": 30.20782,
      "lon": -82.63722,
      "name": null,
      "state": "FL",
      "via": "tag",
      "osm": [
        "w194144363"
      ]
    },
    {
      "lat": 30.28524,
      "lon": -91.93847,
      "name": null,
      "state": "LA",
      "via": "tag",
      "osm": [
        "w1178148298",
        "w1178148299"
      ]
    },
    {
      "lat": 30.31332,
      "lon": -93.68308,
      "name": null,
      "state": "LA",
      "via": "tag",
      "osm": [
        "w1556464114"
      ]
    },
    {
      "lat": 30.32415,
      "lon": -82.12512,
      "name": null,
      "state": "FL",
      "via": "tag",
      "osm": [
        "w194144359"
      ]
    },
    {
      "lat": 30.37342,
      "lon": -83.27257,
      "name": "Weigh Station",
      "state": "FL",
      "via": "tag",
      "osm": [
        "w194144591",
        "w194144592"
      ]
    },
    {
      "lat": 30.41554,
      "lon": -82.89674,
      "name": "White Springs I-75 Weigh Station - Northbound",
      "state": "FL",
      "via": "name",
      "osm": [
        "w614937450"
      ]
    },
    {
      "lat": 30.42227,
      "lon": -82.90323,
      "name": "White Springs I-75 Weigh Station - Southbound",
      "state": "FL",
      "via": "name",
      "osm": [
        "w614941508"
      ]
    },
    {
      "lat": 30.52926,
      "lon": -87.42955,
      "name": null,
      "state": "FL",
      "via": "tag",
      "osm": [
        "w194144465"
      ]
    },
    {
      "lat": 30.55306,
      "lon": -87.36274,
      "name": null,
      "state": "FL",
      "via": "tag",
      "osm": [
        "w194144602",
        "w194144615"
      ]
    },
    {
      "lat": 30.58223,
      "lon": -87.06094,
      "name": "Weigh Scale",
      "state": "FL",
      "via": "name",
      "osm": [
        "w806147600"
      ]
    },
    {
      "lat": 30.63878,
      "lon": -84.98252,
      "name": null,
      "state": "FL",
      "via": "tag",
      "osm": [
        "w194144595",
        "w194144599"
      ]
    },
    {
      "lat": 30.66959,
      "lon": -81.66695,
      "name": null,
      "state": "FL",
      "via": "tag",
      "osm": [
        "w194144576",
        "w194144579"
      ]
    },
    {
      "lat": 30.69946,
      "lon": -81.66213,
      "name": null,
      "state": "FL",
      "via": "tag",
      "osm": [
        "w194108245"
      ]
    },
    {
      "lat": 30.7111,
      "lon": -97.64625,
      "name": null,
      "state": "TX",
      "via": "tag",
      "osm": [
        "w1225786572",
        "w1225786573"
      ]
    },
    {
      "lat": 30.89375,
      "lon": -90.52874,
      "name": "Weight station",
      "state": "LA",
      "via": "name",
      "osm": [
        "n9309370161"
      ]
    },
    {
      "lat": 30.91792,
      "lon": -83.36631,
      "name": "I-75 Southbound Weigh Station",
      "state": "GA",
      "via": "tag",
      "osm": [
        "w1037037126",
        "w1037037127"
      ]
    },
    {
      "lat": 30.97579,
      "lon": -83.20937,